{
  "name": "Jane Doe",
  "headline": "Senior Backend Engineer — San Francisco, CA",
  "summary": "Backend engineer with 7 years building distributed systems and payment infrastructure. Led a team of 5 migrating a monolith to event-driven services.",
  "location": "San Francisco, CA",
  "contact": {
    "email": "jane.doe@example.com",
    "phone": "(415) 555-0142",
    "links": [
      "https://linkedin.com/in/janedoe",
      "https://github.com/janedoe"
    ]
  },
  "skills": [
    "Python",
    "Go",
    "Kafka",
    "PostgreSQL",
    "Kubernetes",
    "gRPC",
    "distributed systems"
  ],
  "experience": [
    {
      "title": "Staff Engineer",
      "company": "Acme Payments",
      "start": "2021",
      "end": "Present",
      "highlights": [
        "Designed an idempotent ledger processing $2B/yr with 99.99% uptime.",
        "Cut p99 latency 40% by introducing a Kafka-based settlement pipeline."
      ]
    },
    {
      "title": "Senior Engineer",
      "company": "Globex",
      "start": "2017",
      "end": "2021",
      "highlights": [
        "Built the fraud-scoring service (Python, gRPC) used across 12 products."
      ]
    }
  ],
  "projects": [
    {
      "name": "OpenLedger",
      "description": "Open-source double-entry accounting library",
      "tech": [
        "Go",
        "Postgres"
      ]
    }
  ],
  "certifications": [
    "AWS Certified Solutions Architect — Professional"
  ],
  "education": [
    {
      "degree": "B.S. Computer Science",
      "institution": "UC Berkeley",
      "year": "2016"
    }
  ]
}